{
  "$schema": "http://json-schema.org/draft-07/schema#",
  "title": "EVERSE Research Software (RS) Tools Validation Schema",
  "description": "Schema for validating software tool entries in the EVERSE Research Software context.",
  "type": "object",
  "definitions": {
    "applicationCategoryObject": {
      "type": "object",
      "properties": {
        "@id": {
          "type": "string",
          "description": "Identifier for the application category",
          "enum": [
            "rs:AnalysisCode",
            "rs:PrototypeTool",
            "rs:ResearchInfrastructureSoftware"
          ]
        }
      },
      "required": [ "@id" ]
    },
    "qualityDimensionObject": {
      "type": "object",
      "properties": {
        "@id": {
          "type": "string",
          "description": "Identifier for the quality dimension. Valid values are dynamically fetched from the EVERSE indicators API at validation time.",
          "pattern": "^dim:[a-z_]+$"
        }
      },
      "required": [ "@id" ],
      "comment": "The enum of valid dimension values is populated dynamically by helpers.py EVERSE api"
    }, 
    
"qualityIndicatorObject": {
  "type": "object",
  "properties": {
    "@id": {
      "type": "string",
      "description": "Identifier for the quality indicator. Valid values are dynamically fetched from the EVERSE indicators API at validation time.",
      "format": "uri"
    }
  },
  "required": ["@id"],
  "comment": "The enum of valid indicator URIs is populated dynamically by helpers.py. If unavailable, validation is skipped."
}
  },
  "properties": {
    "@context": {
      "description": "The JSON-LD context for term definitions",
      "type": "string"
    },
    "@id": {
      "description": "Unique identifier for the software tool",
      "type": "string",
      "format": "uri"
    },
    "@type": {
      "description": "The type of the entity, typically schema:SoftwareApplication",
      "type": [ "string", "array" ],
      "items": {
        "type": "string"
      }
    },
    "name": {
      "description": "The name of the software tool",
      "type": "string"
    },
    "description": {
      "description": "A description of the software tool",
      "type": "string"
    },
    "url": {
      "description": "URL of the software tool",
      "type": "string",
      "format": "uri"
    },
    "identifier": {
      "description": "An identifier for the software tool",
      "type": [ "string", "array", "object" ],
      "format": "uri"
    },
    "isAccessibleForFree": {
      "description": "Whether the software is free to access",
      "type": "boolean"
    },
    "license": {
      "description": "License under which the software is released",
      "type": [ "string", "array", "object" ],
      "items": {
        "type": "string",
        "format": "uri"
      }
    },
    "applicationCategory": {
      "description": "The category of the application",
      "oneOf": [
        { "$ref": "#/definitions/applicationCategoryObject" },
        {
          "type": "array",
          "items": { "$ref": "#/definitions/applicationCategoryObject" }
        }
      ]
    },
    "author": {
      "description": "The author(s) of the software",
      "type": [ "string", "array", "object" ],
      "items": {
        "type": [ "string", "object" ]
      }
    },
    "maintainer": {
      "description": "The maintainer(s) of the software",
      "type": [ "string", "array", "object" ],
      "items": {
        "type": [ "string", "object" ]
      }
    },
    "hasQualityDimension": {
      "description": "Quality dimensions addressed by the tool",
      "oneOf": [
        { "$ref": "#/definitions/qualityDimensionObject" },
        {
          "type": "array",
          "items": { "$ref": "#/definitions/qualityDimensionObject" }
        }
      ]
    },
  "measuresQualityIndicator": {
  "description": "Quality indicators measured by the tool",
  "oneOf": [
    { "$ref": "#/definitions/qualityIndicatorObject" },
    {
      "type": "array",
      "items": { "$ref": "#/definitions/qualityIndicatorObject" }
    }
  ]
},
  "improvesQualityIndicator": {
  "description": "Quality indicators improved by the tool",
  "oneOf": [
    { "$ref": "#/definitions/qualityIndicatorObject" },
    {
      "type": "array",
      "items": { "$ref": "#/definitions/qualityIndicatorObject" }
    }
  ]
},
    "howToUse": {
      "description": "How the software is expected to be used",
      "type": [ "string", "array" ],
      "items": {
        "type": "string",
        "enum": [ "CI/CD", "command-line", "online-service", "library" ]
      }
    },
    "usedBy": {
      "description": "Science cluster using the tool",
      "type": [ "string", "array" ],
      "items": {
        "type": "string",
        "enum": [ "ENVRI", "ESCAPE", "LS-RI", "PaNOSC", "SSHOC", "EOSC-Life" ]
      }
    },
    "appliesToProgrammingLanguage": {
      "description": "Programming languages the tool applies to",
      "type": [ "string", "array" ],
      "items": {
        "type": "string"
      }
    }
  },
  "required": [
    "@context",
    "@id",
    "name",
    "description",
    "license",
    "url",
    "applicationCategory",
    "hasQualityDimension"
  ],
  "additionalProperties": false
}
