{
  "@context": "https://w3id.org/everse/rs#",
  "@id": "https://w3id.org/everse/tools/checkstyle",
  "@type": "schema:SoftwareApplication",
  "name": "Checkstyle",
  "description": "Java code style checker that enforces coding standards and best practices in research software projects, improving code maintainability and readability through automated style analysis.",
  "url": "https://checkstyle.sourceforge.io/",
  "isAccessibleForFree": true,
  "hasQualityDimension": {
    "@id": "dim:maintainability",
    "@type": "@id"
  },
  "howToUse": ["command-line", "CI/CD"],
  "appliesToProgrammingLanguage": ["Java"],
  "license": "https://spdx.org/licenses/LGPL-2.1-only",
  "applicationCategory": [
    { "@id": "rs:PrototypeTool", "@type": "@id" },
    { "@id": "rs:ResearchInfrastructureSoftware", "@type": "@id" },
    { "@id": "rs:AnalysisCode", "@type": "@id" }
  ],
  "measuresQualityIndicator": [
    {
      "@id": "https://w3id.org/everse/i/indicators/has_no_linting_issues",
      "@type": "@id"
    }
  ]
}
