{
  "@context": "https://w3id.org/everse/rs#",
  "@id": "https://w3id.org/everse/tools/choosealicense",
  "@type": "schema:SoftwareApplication",
  "name": "Choose a License",
  "description": "Choose a License is a website that helps developers understand and select open-source software licenses. It provides clear explanations of common licenses, their permissions and limitations, making it easier to choose the right one for your project.",
  "url": "https://choosealicense.com/",
  "isAccessibleForFree": true,
  "license": "https://spdx.org/licenses/MIT",
  "applicationCategory": [
    {
      "@id": "rs:PrototypeTool",
      "@type": "@id"
    },
    {
      "@id": "rs:ResearchInfrastructureSoftware",
      "@type": "@id"
    },
    {
      "@id": "rs:AnalysisCode",
      "@type": "@id"
    }
  ],
  "hasQualityDimension": {
    "@id": "dim:sustainability",
    "@type": "@id"
  },
  "howToUse": [
    "online-service"
  ],
  "improvesQualityIndicator": [
    {
      "@id": "https://w3id.org/everse/i/indicators/software_has_license",
      "@type": "@id"
    }
  ]
}