{
  "@context": "https://w3id.org/everse/rs#",
  "@id": "https://w3id.org/everse/tools/singularityce",
  "@type": "schema:SoftwareApplication",
  "name": "SingularityCE",
  "description": "Container platform designed for high-performance computing environments that provides secure, portable, and reproducible containers for scientific computing workflows, enabling research software deployment across different HPC systems.",
  "url": "https://sylabs.io/singularity/",
  "applicationCategory": {
    "@id": "rs:ResearchInfrastructureSoftware",
    "@type": "@id"
  },
  "isAccessibleForFree": true,
  "hasQualityDimension": [
    { "@id": "dim:compatibility", "@type": "@id" },
    { "@id": "dim:flexibility", "@type": "@id" }
  ],
  "howToUse": ["command-line"],
  "license": "https://opensource.org/license/bsd-3-clause",
  "improvesQualityIndicator": [
    {
      "@id": "https://w3id.org/everse/i/indicators/requirements_specified",
      "@type": "@id"
    },
    {
      "@id": "https://w3id.org/everse/i/indicators/dependency_management",
      "@type": "@id"
    },
    {
      "@id": "https://w3id.org/everse/i/indicators/software_has_documentation",
      "@type": "@id"
    },
    {
      "@id": "https://w3id.org/everse/i/indicators/versioning_standards_use",
      "@type": "@id"
    },
    {
      "@id": "https://w3id.org/everse/i/indicators/has_releases",
      "@type": "@id"
    },
    {
      "@id": "https://w3id.org/everse/i/indicators/descriptive_metadata",
      "@type": "@id"
    },
    {
      "@id": "https://w3id.org/everse/i/indicators/has_published_package",
      "@type": "@id"
    }
  ]
}
