{
  "@context": "https://w3id.org/everse/rs#",
  "@id": "https://w3id.org/everse/tools/sphinx",
  "@type": "SoftwareApplication",
  "applicationCategory": {
    "@id": "rs:ResearchInfrastructureSoftware",
    "@type": "@id"
  },
  "appliesToProgrammingLanguage": ["Python"],
  "description": "Documentation generator that creates comprehensive, searchable documentation from source code and reStructuredText files, improving research software maintainability and usability through professional documentation.",
  "hasQualityDimension": { "@id": "dim:maintainability", "@type": "@id" },
  "howToUse": ["command-line", "CI/CD"],
  "isAccessibleForFree": true,
  "license": "https://spdx.org/licenses/BSD-2-Clause",
  "name": "sphinx",
  "url": "https://www.sphinx-doc.org",
  "improvesQualityIndicator": [
    {
      "@id": "https://w3id.org/everse/i/indicators/software_has_documentation",
      "@type": "@id"
    }
  ]
}
