{
  "@context": "https://w3id.org/everse/rs#",
  "@id": "https://w3id.org/everse/tools/sqaaas",
  "@type": "SoftwareApplication",
  "applicationCategory": { "@id": "rs:AnalysisCode", "@type": "@id" },
  "description": "Software Quality Assessment as a Service platform that analyzes completeness against FAIR4RS reference criteria for research software releases, providing comprehensive quality assessment and awarding capabilities for research software projects.",
  "hasQualityDimension": { "@id": "dim:fairness", "@type": "@id" },
  "howToUse": ["online-service", "CI/CD"],
  "isAccessibleForFree": true,
  "license": "https://spdx.org/licenses/AGPL-3.0-or-later",
  "measuresQualityIndicator": { "@id": "https://w3id.org/everse/i/indicators/software_has_tests" },
  "name": "SQAaas",
  "url": "https://sqaaas.eosc-synergy.eu/",
  "improvesQualityIndicator": [
    {
      "@id": "https://w3id.org/everse/i/indicators/dependency_management",
      "@type": "@id"
    },
    {
      "@id": "https://w3id.org/everse/i/indicators/requirements_specified",
      "@type": "@id"
    }
  ]
}
