{
  "@context": "https://w3id.org/everse/rs#",
  "@id": "https://w3id.org/everse/tools/bearer",
  "@type": "SoftwareApplication",
  "name": "bearer",
  "description": "Bearer CLI is a static application security testing (SAST) tool that scans your source code and analyzes your data flows to discover, filter and prioritize security and privacy risks.",
  "url": "https://github.com/bearer/bearer",
  "isAccessibleForFree": true,
  "hasQualityDimension": { "@id": "dim:sustainability", "@type": "@id" },
  "howToUse": [ "online-service" ],
  "appliesToProgrammingLanguage": [ "JavaScript", "TypeScript", "Ruby", "PHP", "Java", "Go", "Python" ],
  "license": "https://spdx.org/licenses/Elastic-2.0",
  "applicationCategory": { "@id": "rs:AnalysisCode", "@type": "@id" }
}
