{
  "@context": "https://w3id.org/everse/rs#",
  "@id": "https://w3id.org/everse/tools/gitlab-ci-cd",
  "@type": "SoftwareApplication",
  "applicationCategory": {
    "@id": "rs:ResearchInfrastructureSoftware",
    "@type": "@id"
  },
  "description": "Integrated continuous integration and deployment platform that automates research software testing, building, and deployment workflows, improving software reliability and sustainability through comprehensive DevOps practices.",
  "hasQualityDimension": [
    {
      "@id": "dim:sustainability",
      "@type": "@id"
    },
    {
      "@id": "dim:reliability",
      "@type": "@id"
    }
  ],
  "improvesQualityIndicator": [
    {
      "@id": "https://w3id.org/everse/i/indicators/repository_workflows",
      "@type": "@id"
    },
    {
      "@id": "https://w3id.org/everse/i/indicators/software_has_tests",
      "@type": "@id"
    },
    {
      "@id": "https://w3id.org/everse/i/indicators/has_ci-tests",
      "@type": "@id"
    }
  ],
  "howToUse": [
    "CI/CD",
    "command-line",
    "online-service"
  ],
  "isAccessibleForFree": false,
  "license": "https://spdx.org/licenses/MIT",
  "name": "GitLab CI/CD",
  "url": "https://docs.gitlab.com/ci/",
  "improvesQualityIndicator": [
    {
      "@id": "https://w3id.org/everse/i/indicators/repository_workflows",
      "@type": "@id"
    },
    {
      "@id": "https://w3id.org/everse/i/indicators/software_has_tests",
      "@type": "@id"
    },
    {
      "@id": "https://w3id.org/everse/i/indicators/has_ci-tests",
      "@type": "@id"
    }
  ]
}