{
  "@context": "https://w3id.org/everse/rs#",
  "@id": "https://w3id.org/everse/tools/gcov",
  "@type": "SoftwareApplication",
  "name": "gcov",
  "description": "Gcov is a test coverage analysis tool, it considers which lines are actually executed and how often",
  "url": "https://gcc.gnu.org/onlinedocs/gcc/Gcov.html",
  "isAccessibleForFree": true,
  "applicationCategory": [
    { "@id": "rs:PrototypeTool", "@type": "@id" },
    { "@id": "rs:ResearchInfrastructureSoftware", "@type": "@id" },
    { "@id": "rs:AnalysisCode", "@type": "@id" }
  ],
  "hasQualityDimension": [
    {
      "@id": "dim:maintainability",
      "@type": "@id"
    },
    { "@id": "dim:sustainability", "@type": "@id" }
  ],
  "howToUse": ["CI/CD", "command-line"],
  "license": "https://spdx.org/licenses/GPL-2.0-only",
  "measuresQualityIndicator": [
    {
      "@id": "https://w3id.org/everse/i/indicators/software_has_tests",
      "@type": "@id"
    }
  ]
}
