{
  "@context": "https://w3id.org/everse/rs#",
  "@id": "https://w3id.org/everse/tools/junit",
  "@type": "schema:SoftwareApplication",
  "name": "JUnit",
  "description": "Comprehensive unit testing framework for Java that enables systematic testing of research software components, improving code reliability and maintainability through automated test execution and reporting.",
  "url": "https://junit.org/",
  "isAccessibleForFree": true,
  "hasQualityDimension": [
    { "@id": "dim:maintainability", "@type": "@id" },
    { "@id": "dim:reliability", "@type": "@id" }
  ],
  "howToUse": ["command-line"],
  "appliesToProgrammingLanguage": ["Java"],
  "license": "https://spdx.org/licenses/EPL-2.0",
  "applicationCategory": {
    "@id": "rs:ResearchInfrastructureSoftware",
    "@type": "@id"
  },
  "improvesQualityIndicator": [
    {
      "@id": "https://w3id.org/everse/i/indicators/no_critical_vulnerability",
      "@type": "@id"
    },
    {
      "@id": "https://w3id.org/everse/i/indicators/has_ci-tests",
      "@type": "@id"
    },
    {
      "@id": "https://w3id.org/everse/i/indicators/software_has_tests",
      "@type": "@id"
    }
  ]
}
