{
  "@context": "https://w3id.org/everse/rs#",
  "@id": "https://w3id.org/everse/tools/mkdocs",
  "@type": "schema:SoftwareApplication",
  "name": "MkDocs",
  "description": "Static site generator designed for project documentation that creates professional documentation websites from Markdown files, improving research software usability and interaction capability through clear documentation.",
  "url": "https://www.mkdocs.org/",
  "isAccessibleForFree": true,
  "hasQualityDimension": [
    { "@id": "dim:interaction_capability", "@type": "@id" },
    { "@id": "dim:maintainability", "@type": "@id" }
  ],
  "howToUse": ["command-line", "CI/CD"],
  "appliesToProgrammingLanguage": ["Python"],
  "license": "https://spdx.org/licenses/BSD-2-Clause",
  "applicationCategory": [
    {
      "@id": "rs:ResearchInfrastructureSoftware",
      "@type": "@id"
    },
    {
      "@id": "rs:PrototypeTool",
      "@type": "@id"
    }
  ],
  "improvesQualityIndicator": {
    "@id": "https://w3id.org/everse/i/indicators/software_has_documentation",
    "@type": "@id"
  }
}
