{
  "@context": "https://w3id.org/everse/rs#",
  "@id": "https://w3id.org/everse/tools/mkdocs",
  "@type": "schema:SoftwareApplication",
  "name": "MkDocs",
  "description": "MkDocs is a static site generator that's geared towards project documentation, written in Markdown.",
  "url": "https://www.mkdocs.org/",
  "isAccessibleForFree": true,
  "hasQualityDimension": {
    "@id": "dim:Interaction Capability",
    "@type": "@id"
  },
  "howToUse": ["command-line", "CI/CD"],
  "appliesToProgrammingLanguage": ["Python"],
  "license": "https://opensource.org/licenses/BSD-2-Clause",
  "applicationCategory": [
    {
      "@id": "rs:ResearchInfrastructureSoftware",
      "@type": "@id"
    },
    {
      "@id": "rs:PrototypeTool",
      "@type": "@id"
    }
  ]
}
