{
  "@context": "https://w3id.org/everse/rs#",
  "@id": "https://w3id.org/everse/tools/scorep",
  "@type": "SoftwareApplication",
  "applicationCategory": { "@id": "rs:AnalysisCode", "@type": "@id" },
  "appliesToProgrammingLanguage": ["C", "C++"],
  "description": "Scalable Performance Measurement Infrastructure for Parallel Codes that provides highly scalable and easy-to-use tool suite for profiling and event trace recording of HPC applications, enabling performance optimization in computational research.",
  "hasQualityDimension": {
    "@id": "dim:performance_efficiency",
    "@type": "@id"
  },
  "howToUse": ["CI/CD", "command-line"],
  "isAccessibleForFree": true,
  "license": "https://spdx.org/licenses/0BSD",
  "name": "Score-P",
  "url": "https://gitlab.com/score-p/scorep",
  "improvesQualityIndicator": [
    {
      "@id": "https://w3id.org/everse/i/indicators/software_has_tests",
      "@type": "@id"
    },
    {
      "@id": "https://w3id.org/everse/i/indicators/repository_workflows",
      "@type": "@id"
    },
    {
      "@id": "https://w3id.org/everse/i/indicators/software_has_documentation",
      "@type": "@id"
    }
  ]
}
